{
  "candidate": "hybrid-native",
  "platform": "desktop",
  "phase": "smoke",
  "status": "通过",
  "framework": "slint",
  "framework_version": "1.17.1",
  "command": "bash scripts/smoke-linux.sh --backend x11 --timeout 30 hybrid-native",
  "exit_code": 0,
  "timestamp": "2026-09-12T07:27:24Z",
  "log_path": "results/raw/smoke-linux-hybrid-native.log",
  "environment": {
    "os": "Deepin 20.9",
    "glibc": "2.28",
    "backend": "x11",
    "ld_preload": null
  },
  "details": {"ready": {"candidate": "hybrid-native", "platform": "desktop", "framework": "slint", "framework_version": "1.17.1", "backend": "x11", "renderer": "femtovg", "pid": 2143428, "ui_ready": true, "event_loop": "running", "pagination_status": "通过", "pages": 911, "layout_id": 6711085028179287546, "window": {"width": 1080, "height": 720}, "core": {"version": "0.1.0", "abi_version": 1, "abi_entries": 11, "max_window": 262144, "opened_book": 1}, "self_check": {"pages": 911, "chapters": 40, "bytes_consumed": 890720, "aligned_chapters": 26, "forward_ok": true, "backward_ok": true, "reflow_ok": true, "anchor_ok": true, "status": "通过"}, "metrics": {"read_calls": 1917, "copied_bytes": 11750716, "materialized_bytes": 11751786, "page_boundaries": 0, "events_emitted": 1920, "layout_invalidations": 1}, "rust_business_coverage": 100, "platform_specific_loc": 0, "duplicated_ui_loc": 0, "timestamp": "2026-09-12T07:27:24Z"}, "ready_path": "/tmp/nr-ready-zJFutL.json", "leftover_pids": [], "warnings": []},
  "notes": []
}
